Category,Song Name,Movie,YouTube URL,Video Title,Status
ROMANTIC,Tum Hi Ho,Aashiqui 2,https://www.youtube.com/watch?v=81qmmlsIE3k,Aashiqui 2: Tum Hi Ho 8K Full Song | Aditya Roy Kapur | Shraddha Kapoor | Arijit Singh | Mithoon,Found
ROMANTIC,Raabta,Agent Vinod,https://www.youtube.com/watch?v=zlt38OOqwDc,"Raabta (Kehte Hain Khuda) Full Song With Lyrics | Agent Vinod | Saif Ali Khan, Kareena Kapoor,Pritam",Found
ROMANTIC,Tera Ban Jaunga,Kabir Singh,https://www.youtube.com/watch?v=Qdz5n1Xe5Qo,"LYRICAL: Tera Ban Jaunga | Kabir Singh | Shahid K, Kiara A, Sandeep V | Tulsi Kumar, Akhil Sachdeva",Found
ROMANTIC,Raanjhanaa Title Track,Raanjhanaa,https://www.youtube.com/watch?v=vgm1u2gPxzw,"Raanjhanaa - Title Track | Dhanush, Sonam Kapoor | A. R. Rahman | Jaswinder S &amp; Shiraz Uppal",Found
ROMANTIC,Samjhawan,Humpty Sharma Ki Dulhania,https://www.youtube.com/watch?v=wO5j3lv_9Fs,"Arijit Singh, Shreya Ghoshal - Samjhawan | Varun, Alia | Humpty Sharma Ki Dulhania",Found
ROMANTIC,Enna Sona,OK Jaanu,https://www.youtube.com/watch?v=mrdRHsIkK_c,Enna Sona (Official Video) | OK Jaanu | Arijit Singh | Shraddha Kapoor | Aditya Roy Kapoor,Found
ROMANTIC,Janam Janam,Dilwale,https://www.youtube.com/watch?v=pIBoAh4OXhQ,Janam Janam – Dilwale | Shah Rukh Khan | Kajol | Pritam | SRK | Kajol | Lyric Video 2015,Found
ROMANTIC,Sun Saathiya,ABCD 2,https://www.youtube.com/watch?v=TGpG56pg3UU,"Sun Saathiya Full Video | Disney&#39;s ABCD 2 | Varun Dhawan , Shraddha Kapoor | Sachin Jigar | Priya S",Found
ROMANTIC,Tujh Mein Rab Dikhta Hai,Rab Ne Bana Di Jodi,https://www.youtube.com/watch?v=qoq8B8ThgEM,"Tujh Mein Rab Dikhta Hai Song | Rab Ne Bana Di Jodi | Shah Rukh Khan, Anushka Sharma | Roop Kumar",Found
ROMANTIC,Kaun Tujhe,M.S. Dhoni,https://www.youtube.com/watch?v=atVof3pjT-I,KAUN TUJHE Full  Video | M.S. DHONI -THE UNTOLD STORY |Amaal Mallik Palak|Sushant Singh Disha Patani,Found
ROMANTIC,Tum Se Hi,Jab We Met,https://www.youtube.com/watch?v=mt9xg0mmt28,"Full Video: Tum Se Hi | Jab We Met | Kareena Kapoor, Shahid Kapoor | Mohit Chauhan | Pritam",Found
ROMANTIC,Pehli Nazar Mein,Race,https://www.youtube.com/watch?v=BadBAMnPX0I,"Pehli Nazar Mein Kaise Jaado Kar Diya | Atif Aslam Hits | Race I Akshaye, Bipasha &amp; Saif Ali",Found
ROMANTIC,Tera Hone Laga Hoon,Ajab Prem Ki Ghazab Kahani,https://www.youtube.com/watch?v=rTuxUAuJRyY,"Tera Hone Laga Hoon Lyrical - Ajab Prem Ki Ghazab Kahani | Atif Aslam | Ranbir, Katrina K | Pritam",Found
ROMANTIC,Hawayein,Jab Harry Met Sejal,https://www.youtube.com/watch?v=cYOB941gyXI,"Hawayein Lyrical Video - Jab Harry Met Sejal | Shah Rukh Khan, Anushka | Arijit Singh | Pritam",Found
ROMANTIC,Tere Sang Yaara,Rustom,https://www.youtube.com/watch?v=gIOea2pgfIo,Tere Sang Yaara - Full Video | Rustom | Akshay Kumar &amp; Ileana D&#39;cruz | Arko | Manoj M,Found
ROMANTIC,Hasi Ban Gaye,Hamari Adhuri Kahani,https://www.youtube.com/watch?v=d0x2UbhbdmY,"Hasi | Hamari Adhuri Kahani | Emraan Hashmi, Vidya Balan | Ami Mishra | Mohit Suri | 4K",Found
ROMANTIC,Tum Mile (Title Track),Tum Mile,https://www.youtube.com/watch?v=UcqI3uBKgTg,"Tum Mile Full Video - Title Track | Emraan Hashmi, Soha Ali | Pritam| Neeraj Shridhar | Kumaar | 4K",Found
ROMANTIC,Dil Diyan Gallan,Tiger Zinda Hai,https://www.youtube.com/watch?v=SAcpESN_Fk4,"Dil Diyan Gallan Song | Tiger Zinda Hai | Salman Khan, Katrina Kaif | Atif Aslam | Vishal &amp; Shekhar",Found
ROMANTIC,Tujhe Kitna Chahne Lage,Kabir Singh,https://www.youtube.com/watch?v=AgX2II9si7w,"Full Song: Tujhe Kitna Chahne Lage | Kabir Singh | Mithoon Feat. Arijit Singh | Shahid K, Kiara A",Found
ROMANTIC,Aaj Din Chadheya,Love Aaj Kal,https://www.youtube.com/watch?v=IImcBEHuDRI,"Aaj Din Chadheya - Lyrical Video | Saif Ali Khan, Deepika P | Love Aaj Kal | Rahat Fateh Ali Khan",Found
ROMANTIC,Agar Tum Mil Jao,Zeher,https://www.youtube.com/watch?v=FH-oV5nXblA,Agar Tum Mil Jao (From &quot;Zeher&quot;),Found
ROMANTIC,Khuda Jaane,Bachna Ae Haseeno,https://www.youtube.com/watch?v=cmMiyZaSELo,"Khuda Jaane | Full Song | Bachna Ae Haseeno | Ranbir Kapoor, Deepika | Vishal &amp; Shekhar, KK, Shilpa",Found
ROMANTIC,Tera Yaar Hoon Main,Sonu Ke Titu Ki Sweety,https://www.youtube.com/watch?v=EatzcaVJRMs,Full Video: Tera Yaar Hoon Main | Sonu Ke Titu Ki Sweety | Arijit Singh Rochak Kohli | Song 2018,Found
ROMANTIC,Shiddat Title Track,Shiddat,https://www.youtube.com/watch?v=iSo9l950QLo,"Shiddat Title Track (Full Video) |Sunny Kaushal,Radhika Madan, Mohit Raina, Diana P | Manan Bhardwaj",Found
ROMANTIC,Raataan Lambiyan,Shershaah,https://www.youtube.com/watch?v=gvyUuxdRdR4,Raataan Lambiyan – Official Video | Shershaah | Sidharth – Kiara | Tanishk B| Jubin Nautiyal  |Asees,Found
ROMANTIC,O Saathi,Baaghi 2,https://www.youtube.com/watch?v=YuXLN23ZGQo,O Saathi Lyrical Video | Baaghi 2 | Tiger Shroff | Disha Patani | Arko | Ahmed Khan Sajid Nadiadwala,Found
ROMANTIC,Jeene Laga Hoon,Ramaiya Vastavaiya,https://www.youtube.com/watch?v=pkzOBl1p7y4,"Jeene Laga Hoon | Ramaiya Vastavaiya | Girish Kumar, Shruti Haasan | Atif Aslam, Shreya Goshal",Found
ROMANTIC,Gerua,Dilwale,https://www.youtube.com/watch?v=AEIVhBS6baE,Gerua - Shah Rukh Khan | Kajol | Dilwale | Pritam | Arijit Singh | Antara Mitra,Found
ROMANTIC,Tum Jo Aaye,Once Upon A Time In Mumbaai,https://www.youtube.com/watch?v=kTXilT_KbUM,"Lyrical:Tum Jo Aaye |Once Upon A Time In Mumbai| Ajay Devgn,Rahat Fateh Ali Khan,Tulsi Kumar, Pritam",Found
ROMANTIC,Main Rang Sharbaton Ka,Phata Poster Nikla Hero,https://www.youtube.com/watch?v=aKdqQ5BC_S4,"Main Rang Sharbaton Ka | Phata Poster Nikhla Hero | Atif Aslam, Chinmayi | Romantic Love Songs",Found
SAD,Agar Tum Saath Ho,Tamasha,https://www.youtube.com/watch?v=xRb8hxwN5zc,"&#39;AGAR TUM SAATH HO&#39; Full VIDEO song | Tamasha | Ranbir Kapoor, Deepika Padukone | T-Series",Found
SAD,Channa Mereya,Ae Dil Hai Mushkil,https://www.youtube.com/watch?v=284Ov7ysmfA,"Channa Mereya Full Video - ADHM | Ranbir Kapoor, Anushka | Arijit Singh | Pritam | Karan Johar",Found
SAD,Tujhe Bhula Diya,Anjaana Anjaani,https://www.youtube.com/watch?v=-Hb2DeHvvEg,"&#39;&#39;Tujhe Bhula Diya&quot; (Full Song) Anjaana Anjaani | Ranbir Kapoor, Priyanka Chopra",Found
SAD,Tadap Tadap,Hum Dil De Chuke Sanam,https://www.youtube.com/watch?v=KwiDJclWo44,"Tadap Tadap Ke Full Video Song | Hum Dil De Chuke Sanam | K.K.| Salman Khan, Aishwarya Rai",Found
SAD,Bhula Dena,Aashiqui 2,https://www.youtube.com/watch?v=II4CvWvgIsI,"Bhula Dena Mujhe Video Song Aashiqui 2 | Aditya Roy Kapur, Shraddha Kapoor",Found
SAD,Judaai,Badlapur,https://www.youtube.com/watch?v=wzLo4iQTZqQ,Judaai (Full Video) Badlapur Ft. Varun Dhawan &amp; Yami Gautam,Found
SAD,Phir Bhi Tumko Chaahunga,Half Girlfriend,https://www.youtube.com/watch?v=_iktURk0X-A,"Phir Bhi Tumko Chaahunga - Full Song | Arijit Singh | Arjun K &amp; Shraddha K | Mithoon, Manoj M",Found
SAD,Abhi Mujh Mein Kahin,Agneepath,https://www.youtube.com/watch?v=oWKgpB2zpgw,"Ajay-Atul - Abhi Mujh Mein Kahin Best Lyric|Agneepath|Priyanka Chopra,Hrithik|Sonu Nigam",Found
SAD,Humdard,Ek Villain,https://www.youtube.com/watch?v=FJ55SHCzt88,Humdard Full Video Song | Ek Villain | Arijit Singh | Mithoon,Found
SAD,Kabira (Encore),Yeh Jawaani Hai Deewani,https://www.youtube.com/watch?v=ta-W16uw7zg,"Kabira Encore - Yeh Jawaani Hai Deewani | Ranbir Kapoor, Deepika Padukone",Found
SAD,Chal Wahan Jaate Hain,Arijit Singh,https://www.youtube.com/watch?v=H9UhPph--78,Chal Wahan Jaate Hain,Found
SAD,Bekhayali,Kabir Singh,https://www.youtube.com/watch?v=VOLKJJvfAbg,"Bekhayali Full Song | Kabir Singh | Shahid K,Kiara A|Sandeep Reddy Vanga | Sachet-Parampara | Irshad",Found
SAD,Dard Dilo Ke,Xpose,https://www.youtube.com/watch?v=CExS4CBufng,"The Xpose: Dard Dilo Ke | Video Song | Himesh Reshammiya, Yo Yo Honey Singh",Found
SAD,Tera Zikr,Darshan Raval,https://www.youtube.com/watch?v=eK0IIyBlYew,Tera Zikr - Darshan Raval | Official Video - Latest New Hit Song,Found
SAD,Ae Dil Hai Mushkil (Title Track),Ae Dil Hai Mushkil,https://www.youtube.com/watch?v=6FURuLYrR_Q,"Ae Dil Hai Mushkil Title Track Full Video - Ranbir, Anushka, Aishwarya | Arijit Singh| Pritam",Found
SAD,Khairiyat,Chhichhore,https://www.youtube.com/watch?v=hoNb6HuNmU0,"Full Song: KHAIRIYAT (BONUS TRACK) | CHHICHHORE | Sushant, Shraddha | Pritam, Amitabh B|Arijit Singh",Found
SAD,Tu Hi Hai,Dear Zindagi,https://www.youtube.com/watch?v=wHD6z0vuWiM,Tu Hi Hai Full Video - Dear Zindagi | Alia Bhatt | Ali Zafar | Arijit Singh | Amit Trivedi,Found
SAD,Mann Mera,Table No. 21,https://www.youtube.com/watch?v=ZGEGEeANyO8,"Mann Mera - Full Video Song | Gajendra Verma | Tina Desai, Rajeev Khandelwal | Table No.21",Found
SAD,Main Dhoondne Ko Zamaane Mein,Heartless,https://www.youtube.com/watch?v=FIu4lel3S_o,"Heartless: Main Dhoondne Ko Zamaane Mein Full Song | Arijit Singh | Adhyayan Suman, Ariana Ayam",Found
SAD,Lo Maan Liya,Raaz Reboot,https://www.youtube.com/watch?v=KSGYVl4ZgRs,"LO MAAN LIYA Full Video Song | Raaz Reboot | Arijit Singh|Emraan Hashmi,Kriti Kharbanda,Gaurav Arora",Found
SAD,Hamari Adhuri Kahani,Title Track,https://www.youtube.com/watch?v=sVRwZEkXepg,"Hamari Adhuri Kahani - Lyrical Song | Arjit Singh | Emraan Hashmi, Vidya Balan | Jeet Gannguli",Found
SAD,Dil Kyun Yeh Mera,Kites,https://www.youtube.com/watch?v=maKDIvUVkQo,"Kites  &quot;Dil Kyun Yeh Mera Shor Kare&quot; Full Song (HD) | Hrithik Roshan, Bárbara Mori",Found
SAD,Tu Jaane Na,Ajab Prem Ki Ghazab Kahani,https://www.youtube.com/watch?v=P8PWN1OmZOA,"Tu Jaane Na Lyrical - Ajab Prem Ki Ghazab Kahani | Atif Aslam | Ranbir Kapoor, Katrina Kaif | Pritam",Found
SAD,Tujhe Sochta Hoon,Jannat 2,https://www.youtube.com/watch?v=PkhfKq9m0Uo,KK | Tujhe Sochta Hoon (Lyrical Audio) Emraan Hashmi | Esha Gupta | Pritam | Jannat 2,Found
SAD,Zindagi Kuch Toh Bata,Bajrangi Bhaijaan,https://www.youtube.com/watch?v=jwrCYAIdkeM,&#39;Zindagi Kuch Toh Bata (Reprise)&#39; Song Pritam | Salman &amp; Kareena  | Bajrangi Bhaijaan | Jubin,Found
SAD,Pachtaoge,Arijit Singh,https://www.youtube.com/watch?v=PVxc5mIHVuQ,"Arijit Singh: Pachtaoge | Vicky Kaushal, Nora Fatehi |Jaani, B Praak, Arvindr Khaira | Bhushan Kumar",Found
SAD,Chitthi,Jubin Nautiyal,https://www.youtube.com/watch?v=AV8xUbIFhdc,Chitthi Video Song | Feat. Jubin Nautiyal &amp; Akanksha Puri | Kumaar | New Song 2019 | T-Series,Found
SAD,Tum Ho,Rockstar,https://www.youtube.com/watch?v=gkCKTuR-ECI,"Rockstar: Tum Ho (Lyrical Video) Song | Ranbir Kapoor | Nargis | A R Rahman, Mohit Chauhan",Found
SAD,Kun Faya Kun,Rockstar,https://www.youtube.com/watch?v=T94PHkuydcw,"ROCKSTAR: Kun Faya Kun (Full Video Song) | Ranbir Kapoor | A.R. Rahman, Javed Ali, Mohit Chauhan",Found
SAD,Jaan Nisar,Kedarnath,https://www.youtube.com/watch?v=vdbP_3o73qI,Jaan Nisaar - Lyrical | Kedarnath| Arijit Singh | Sushant Singh Rajput | Sara Ali Khan| Amit Trivedi,Found
CALM,Kun Faya Kun,Rockstar,https://www.youtube.com/watch?v=T94PHkuydcw,"ROCKSTAR: Kun Faya Kun (Full Video Song) | Ranbir Kapoor | A.R. Rahman, Javed Ali, Mohit Chauhan",Found
CALM,Ilahi,Yeh Jawaani Hai Deewani,https://www.youtube.com/watch?v=fdubeMFwuGs,"Ilahi Full Video Song | Yeh Jawaani Hai Deewani | Ranbir Kapoor, Deepika Padukone | Pritam",Found
CALM,Khwaja Mere Khwaja,Jodhaa Akbar,https://www.youtube.com/watch?v=4YbAaRFk70o,Khwaja Mere Khwaja - Jodhaa Akbar | A. R. Rahman | Hrithik Roshan | Aishwarya Rai,Found
CALM,Maula Mere Maula,Anwar,https://www.youtube.com/watch?v=l5sgIqzlPXc,Maula Mere Maula | Anwar (2007) | Siddharth Koirala | Nauheed Cyrusi| Bollywood Romantic Song,Found
CALM,Nadaan Parindey,Rockstar,https://www.youtube.com/watch?v=6MgsHSAcI9k,"ROCKSTAR: Nadaan Parinde (Lyrical Video) | Ranbir Kapoor | A.R Rahman | Mohit Chauhan, Irshad Kamil",Found
CALM,Aayat,Bajirao Mastani,https://www.youtube.com/watch?v=vKDsAB1ccn0,"Aayat - Lyrical Video | Bajirao Mastani | Arijit Singh | Ranveer, Deepika | Sanjay Leela Bhansali",Found
CALM,Alvida,Life in a Metro,https://www.youtube.com/watch?v=hM9QDpLHhdw,Alvida - Life In A Metro | Pritam | KK | Amitabh Verma | Pseudo Video,Found
CALM,Khaabon Ke Parinday,Zindagi Na Milegi Dobara,https://www.youtube.com/watch?v=R0XjwtP_iTY,"Khaabon Ke Parinday (Full video song) Zindagi Na Milegi Dobara | Hrithik Roshan, Kartina Kaif",Found
CALM,Safarnama,Tamasha,https://www.youtube.com/watch?v=7mTDBsdfw88,"&quot;Safarnama&quot; Video Song | Tamasha | Ranbir Kapoor, Deepika Padukone | T-Series",Found
CALM,Tera Zikr,Darshan Raval,https://www.youtube.com/watch?v=eK0IIyBlYew,Tera Zikr - Darshan Raval | Official Video - Latest New Hit Song,Found
CALM,Shikayatein,Lootera,https://www.youtube.com/watch?v=eN5dP3BZALQ,"Shikayatein Lootera Full Video Song | Sonakshi Sinha, Ranveer Singh",Found
CALM,Saiyyara,Ek Tha Tiger,https://www.youtube.com/watch?v=A5pSnIwbpaM,"Saiyaara Full Song | Ek Tha Tiger | Salman Khan, Katrina Kaif | Mohit Chauhan, Tarannum, Sohail Sen",Found
CALM,Ye Honsla,Dor,https://www.youtube.com/watch?v=3TndEMf6zws,Ye Honsla,Found
CALM,Kabira (Original),YJHD,https://www.youtube.com/watch?v=jHNNMj5bNQw,"&quot;Kabira Full Song&quot; Yeh Jawaani Hai Deewani | Pritam | Ranbir Kapoor, Deepika Padukone",Found
CALM,Dil Mere,The Local Train,https://www.youtube.com/watch?v=qLCLvzTGFVM,The Local Train - Dil Mere (Official),Found
CALM,Choo Lo,The Local Train,https://www.youtube.com/watch?v=sFMRqxCexDk,The Local Train - Aalas Ka Pedh - Choo Lo (Official Audio),Found
CALM,Aashayein,Iqbal,https://www.youtube.com/watch?v=CaI0xNLpurM,"Aashayein - Iqbal | Naseeruddin Shah, Shreyas Talpade | KK &amp; Salim Merchant | Hindi Hit Songs",Found
CALM,Manzar Hai Yeh Naya,Life in a Metro,https://www.youtube.com/watch?v=XjRFk1Qq2Nw,Mann Ye Mera (Full Video) | Vishal Mishra | Metro…In Dino | Pritam | Anurag Basu | Bhushan Kumar,Found
CALM,Subhanallah,Yeh Jawaani Hai Deewani,https://www.youtube.com/watch?v=QYO6AlxiRE4,"&quot;Subhanallah&quot;  Full Video Song | Yeh Jawaani Hai Deewani | Pritam | Ranbir Kapoor, Deepika Padukone",Found
CALM,Tu Aashiqui Hai,Jhankaar Beats,https://www.youtube.com/watch?v=aw0s2KaoA2Q,"Tu Aashiqui Hai Full Video - Jhankaar Beats|KK|Vishal &amp; Shekhar| Sanjay Suri, Juhi Chawla",Found
CALM,Iktara,Wake Up Sid,https://www.youtube.com/watch?v=akjdj6iHttY,Iktara - Lyric Video - Wake Up Sid | Ranbir Kapoor | Konkona Sen Sharma,Found
CALM,Aahista Aahista,Bachna Ae Haseeno,https://www.youtube.com/watch?v=-m9IGI5EgyM,"Aahista Aahista Song | Bachna Ae Haseeno | Ranbir Kapoor, Minissha Lamba | Lucky Ali, Shreya Ghoshal",Found
CALM,Aas Paas Khuda,Anjaana Anjaani,https://www.youtube.com/watch?v=jAUSF4_ygJg,"&quot;Tu Na Jaane Aas Paas Hai Khuda&quot; Full HD Song | Anjaana Anjaani | Priyanka Chopra, Ranbir Kapoor",Found
CALM,Behti Hawa Sa Tha Woh,3 Idiots,https://www.youtube.com/watch?v=ewvddSUEONQ,"Behti Hawa Sa Tha Woh – 3 Idiots | Aamir Khan, Madhavan, Sharman J | Shaan &amp; Shantanu M | Swanand K",Found
CALM,Phir Se Ud Chala,Rockstar,https://www.youtube.com/watch?v=2mWaqsC3U7k,"ROCKSTAR: Phir Se Ud Chala (Full Song) | Ranbir Kapoor, Nargis Fakhri | A. R. Rahman, Mohit Chauhan",Found
CALM,Rehna Tu,Delhi-6,https://www.youtube.com/watch?v=ZYGyuaEU2aA,"Rehna Tu Lyrical | Delhi 6 | Abhishek Bachchan, Sonam Kapoor | A R Rahman, Benny Dayal, Tanvi",Found
CALM,Kabhi Kabhi Aditi,Jaane Tu Ya Jaane Na,https://www.youtube.com/watch?v=HIbzXaBdwZw,Full Video: Kabhi Kabhi Aditi Zindagi | Jaane Tu Ya Jaane Na | A.R. Rahman | Rashid Ali,Found
CALM,Maula Mere Le Le Meri Jaan,Chak De India,https://www.youtube.com/watch?v=90hNT7UYlZA,Maula Mere Lele Meri Jaan | Full Song | Chak De India | Shah Rukh Khan | Krishna | Salim-Sulaiman,Found
CALM,Sajde,Kill Dil,https://www.youtube.com/watch?v=P4fzOSVy6-o,"Sajde | Full Song | Kill Dil | Ranveer, Parineeti, Arijit Singh, Nihira | Shankar-Ehsaan-Loy, Gulzar",Found
CALM,Dil Dhadakne Do,ZNMD,https://www.youtube.com/watch?v=WuMWwPHTSoY,"Dil Dhadakne Do Full Video Song | Zindagi Na Milegi Dobara | Hrithik Roshan, Farhan Akhtar",Found
DRIVE,Dil Chahta Hai,Title Track,https://www.youtube.com/watch?v=9coA7bcpJII,Dil Chahta Hai [Full Song] Dil Chahta Hai,Found
DRIVE,Khaabon Ke Parinday,ZNMD,https://www.youtube.com/watch?v=R0XjwtP_iTY,"Khaabon Ke Parinday (Full video song) Zindagi Na Milegi Dobara | Hrithik Roshan, Kartina Kaif",Found
DRIVE,Ilahi,Yeh Jawaani Hai Deewani,https://www.youtube.com/watch?v=fdubeMFwuGs,"Ilahi Full Video Song | Yeh Jawaani Hai Deewani | Ranbir Kapoor, Deepika Padukone | Pritam",Found
DRIVE,Sooraj Dooba Hai,Roy,https://www.youtube.com/watch?v=nJZcbidTutE,&#39;Sooraj Dooba Hain&#39; FULL VIDEO SONG | Arijit singh Aditi Singh Sharma | T-SERIES,Found
DRIVE,Zinda,Bhaag Milkha Bhaag,https://www.youtube.com/watch?v=Ax0G_P2dSBw,Zinda Lyric Video - Bhaag Milkha Bhaag|Farhan Akhtar|Siddharth Mahadevan|Prasoon Joshi,Found
DRIVE,Safarnama,Tamasha,https://www.youtube.com/watch?v=7mTDBsdfw88,"&quot;Safarnama&quot; Video Song | Tamasha | Ranbir Kapoor, Deepika Padukone | T-Series",Found
DRIVE,Hairat,Anjaana Anjaani,https://www.youtube.com/watch?v=aHEbLVElUwY,"Hairat Lyrical | Anjaana Anjaani | Ranbir Kapoor, Priyanka Chopra | Lucky Ali |Vishal - Shekhar",Found
DRIVE,Phir Se Ud Chala,Rockstar,https://www.youtube.com/watch?v=2mWaqsC3U7k,"ROCKSTAR: Phir Se Ud Chala (Full Song) | Ranbir Kapoor, Nargis Fakhri | A. R. Rahman, Mohit Chauhan",Found
DRIVE,Patakha Guddi,Highway,https://www.youtube.com/watch?v=8HDTS80dlr4,"Patakha Guddi Highway Full Video Song (Official) || A.R Rahman | Alia Bhatt, Randeep Hooda",Found
DRIVE,Aashayein,Iqbal,https://www.youtube.com/watch?v=CaI0xNLpurM,"Aashayein - Iqbal | Naseeruddin Shah, Shreyas Talpade | KK &amp; Salim Merchant | Hindi Hit Songs",Found
DRIVE,Allah Ke Bande,Kailash Kher,https://www.youtube.com/watch?v=KSwd2fYX9vg,Allah Ke Bande | Waisa Bhi Hota Hai - II (2003) | Arshad Warsi | Kailash Kher | Superhit Song,Found
DRIVE,Aao Milo Chalein,Jab We Met,https://www.youtube.com/watch?v=Mo5tQDcs__g,"Full Video:Aao Milo Chalen|Jab We Met|Shahid Kapoor, Kareena Kapoor|Pritam, Shaan, Ustad Sultan Khan",Found
DRIVE,Uff Teri Ada,Karthik Calling Karthik,https://www.youtube.com/watch?v=qTsAdjULqwg,"Uff Teri Adaa Full Video Song | Karthik Calling Karthik | Farhan Akhtar, Deepika Padukone",Found
DRIVE,Ik Junoon (Paint It Red),ZNMD,https://www.youtube.com/watch?v=5PbWtDGOL8A,"Ik Junoon (Paint it red) Full Song Zindagi Na Milegi Dobara | Hrithik, Katrina, Farhan Akhtar",Found
DRIVE,Zinda Hoon Yaar,Lootera,https://www.youtube.com/watch?v=cgHLvt0rxmM,"Zinda Full Video | Lootera | Ranveer Singh, Sonakshi Sinha | Amit Trivedi | Amitabh Bhattacharya",Found
DRIVE,Chal Chalein,Lakshya,https://www.youtube.com/watch?v=QfYzSutYy0M,Chal Chale [Full Song] Woh Lamhe,Found
DRIVE,Dil Dhadakne Do,ZNMD,https://www.youtube.com/watch?v=WuMWwPHTSoY,"Dil Dhadakne Do Full Video Song | Zindagi Na Milegi Dobara | Hrithik Roshan, Farhan Akhtar",Found
DRIVE,Ye Dooriyan,Love Aaj Kal,https://www.youtube.com/watch?v=kPtn26x8TZM,"Dooriyan - Lyrical Video | Love Aaj Kal | Saif Ali Khan, Deepika Padukone | Mohit Chauhan | Pritam",Found
DRIVE,Shaam,Aisha,https://www.youtube.com/watch?v=kl8T6tsOZJk,Sham Best Lyric Video - Aisha|Sonam Kapoor|Abhay Deol|Javed Akhtar|Amit Trivedi,Found
DRIVE,Behti Hawa Sa Tha Woh,3 Idiots,https://www.youtube.com/watch?v=ewvddSUEONQ,"Behti Hawa Sa Tha Woh – 3 Idiots | Aamir Khan, Madhavan, Sharman J | Shaan &amp; Shantanu M | Swanand K",Found
DRIVE,Kholo Kholo,Taare Zameen Par,https://www.youtube.com/watch?v=FIaUYKLg5S4,Kholo Kholo (Full Song) Film - Taare Zameen Par,Found
DRIVE,Tum Se Hi (Reprise),Jab We Met,https://www.youtube.com/watch?v=nWxz9BdtTPs,"Tum Se Hi (Unplugged) Lyrical Video: Shahid Kapoor, Kareena Kapoor Khan | Sarthak S | &quot;Jab We Met&quot;",Found
DRIVE,Tera Hone Laga Hoon (Reprise),Ajab Prem Ki Ghazab Kahani,https://www.youtube.com/watch?v=rTuxUAuJRyY,"Tera Hone Laga Hoon Lyrical - Ajab Prem Ki Ghazab Kahani | Atif Aslam | Ranbir, Katrina K | Pritam",Found
DRIVE,Jeene Ke Hai Chaar Din,Mujhse Shaadi Karogi,https://www.youtube.com/watch?v=xyngwCXoMdI,"Lyrical Video:Jeene Ke Hain Chaar Din |Mujhse Shaadi Karogi|Sonu N,Sunidhi C| Salman,Akshay,Priyanka",Found
DRIVE,Gallan Goodiyan,Dil Dhadakne Do,https://www.youtube.com/watch?v=jCEdTq3j-0U,&#39;Gallan Goodiyaan&#39; Full VIDEO Song | Dil Dhadakne Do | T-Series,Found
DRIVE,Yeh Ishq Hai,Jab We Met,https://www.youtube.com/watch?v=dXpG0kavjUo,"Full Video: Yeh Ishq Hai | Jab We Met | Kareena Kapoor, Shahid Kapoor | Pritam | Shreya Ghoshal",Found
DRIVE,Hum Jo Chalne Lage,Jab We Met,https://www.youtube.com/watch?v=Mo5tQDcs__g,"Full Video:Aao Milo Chalen|Jab We Met|Shahid Kapoor, Kareena Kapoor|Pritam, Shaan, Ustad Sultan Khan",Found
DRIVE,Main Hoon Na (Title),Main Hoon Na,https://www.youtube.com/watch?v=0L0QinW_A70,"Main Hoon Na Title Track Lyrical Video | Sonu Nigam, Shreya Ghosal | Shahrukh Khan, Sushmita Sen",Found
DRIVE,Kyon,Barfi!,https://www.youtube.com/watch?v=UDHklYvDkv8,"Kyon - Lyrical Video | Ranbir Kapoor, Priyanka Chopra | Barfi | Papon, Sunidhi",Found
DRIVE,Mitwa,Kabhi Alvida Naa Kehna,https://www.youtube.com/watch?v=ru_5PA8cwkE,"Mitwa Full Video, KANK - Shahrukh Khan,Rani Mukherjee|Shafqat Amanat Ali|Shankar Mahadevan",Found
PARTY,Kala Chashma,Baar Baar Dekho,https://www.youtube.com/watch?v=k4yXQkG2s1E,"Kala Chashma | Baar Baar Dekho | Sidharth M Katrina K | Prem, Hardeep, Badshah, Kam, Neha, Indeep",Found
PARTY,Kar Gayi Chull,Kapoor & Sons,https://www.youtube.com/watch?v=NTHz9ephYTw,"Kar Gayi Chull - Kapoor &amp; Sons | Sidharth Malhotra, Alia Bhatt | Badshah | Amaal Mallik | Fazilpuria",Found
PARTY,Bom Diggy Diggy,Sonu Ke Titu Ki Sweety,https://www.youtube.com/watch?v=yIIGQB6EMAM,Bom Diggy Diggy  (VIDEO) | Zack Knight | Jasmin Walia | Sonu Ke Titu Ki Sweety,Found
PARTY,London Thumakda,Queen,https://www.youtube.com/watch?v=udra3Mfw2oo,"Queen: London Thumakda Full Video Song | Kangana Ranaut, Raj Kumar Rao",Found
PARTY,Nashe Si Chadh Gayi,Befikre,https://www.youtube.com/watch?v=HoCwa6gnmM0,"Nashe Si Chadh Gayi | Full Song | Befikre, Ranveer Singh, Vaani Kapoor, Arijit Singh, Vishal-Shekhar",Found
PARTY,Badtameez Dil,YJHD,https://www.youtube.com/watch?v=II2EO3Nw4m0,"Badtameez Dil Full Song HD Yeh Jawaani Hai Deewani | PRITAM | Ranbir Kapoor, Deepika Padukone",Found
PARTY,The Breakup Song,Ae Dil Hai Mushkil,https://www.youtube.com/watch?v=CvPdtf8Ijj4,The Breakup Song - Ae Dil Hai Mushkil |  Latest Official Song 2016 | Pritam | Arijit I Badshah,Found
PARTY,Malhari,Bajirao Mastani,https://www.youtube.com/watch?v=l_MyUGq7pgs,Malhari - Full Video Song | Bajirao Mastani | Ranveer Singh | Vishal Dadlani | Sanjay Leela Bhansali,Found
PARTY,Aankh Marey,Simmba,https://www.youtube.com/watch?v=_KhQT-LGb-4,"SIMMBA: Aankh Marey | Ranveer Singh, Sara Ali Khan | Tanishk Bagchi,Mika Singh,Neha Kakkar,  Kumar S",Found
PARTY,Dil Dhadakne Do,ZNMD,https://www.youtube.com/watch?v=WuMWwPHTSoY,"Dil Dhadakne Do Full Video Song | Zindagi Na Milegi Dobara | Hrithik Roshan, Farhan Akhtar",Found
PARTY,Gallan Goodiyan,DDD,https://www.youtube.com/watch?v=MtiCtsvNfgk,Gallan Goodiyaan New Song From DDD,Found
PARTY,Desi Girl,Dostana,https://www.youtube.com/watch?v=wDIrpvH8MzE,"Desi Girl Full Video - Dostana |John, Abhishek, Priyanka | Sunidhi Chauhan, Vishal Dadlani",Found
PARTY,Saturday Saturday,Humpty Sharma Ki Dulhania,https://www.youtube.com/watch?v=rW9_-dVCmrM,"Saturday Saturday | Humpty Sharma Ki Dulhania | Varun Dhawan, Alia Bhatt |Badshah, Akriti Kakkar| 4K",Found
PARTY,Subha Hone Na De,Desi Boyz,https://www.youtube.com/watch?v=Y7G-tYRzwYY,"&quot;Subha Hone Na De Full Song&quot;| Desi Boyz | Akshay Kumar ,John Abraham | Pritam |  Mika Singh, Kumaar",Found
PARTY,Party On My Mind,Race 2,https://www.youtube.com/watch?v=_YqzZWXkoq0,"Party On My Mind | Race 2 | Saif Ali, John, Deeepika, Jacqueline &amp; Amisha | Pritam | Honey Singh",Found
PARTY,Baby Ko Bass Pasand Hai,Sultan,https://www.youtube.com/watch?v=p062GuAhsRs,"Baby Ko Bass Pasand Hai Full Song | Sultan | Salman Khan, Anushka, Vishal-Shekhar, Badshah, Shalmali",Found
PARTY,Abhi Toh Party Shuru Hui Hai,Khoobsurat,https://www.youtube.com/watch?v=8LZgzAZ2lpQ,&#39;Abhi Toh Party Shuru Hui Hai&#39; Full Video Song | Khoobsurat | Badshah | Sonam Kapoor | Aastha,Found
PARTY,Sweety Tera Drama,Bareilly Ki Barfi,https://www.youtube.com/watch?v=RpuhD_xKadk,"Sweety Tera Drama | Bareilly Ki Barfi | Kriti Sanon, Ayushmann, Rajkummar | Tanishk | Pawni , Dev",Found
PARTY,Proper Patola,Namaste England,https://www.youtube.com/watch?v=YmXJp4RtBCM,Proper Patola - Official Video | Namaste England | Arjun | Parineeti | Badshah | Diljit | Aastha,Found
PARTY,Dil Chori,SKTKS,https://www.youtube.com/watch?v=xWi8nDUjHGA,"Yo Yo Honey Singh: DIL CHORI (Video) Simar Kaur, Ishers | Hans Raj Hans | Sonu Ke Titu Ki Sweety",Found
PARTY,Tera Hero Idhar Hai,Main Tera Hero,https://www.youtube.com/watch?v=9vkcYxbGdTE,Palat Tera Hero Idhar Hai (Full Video) Song Main Tera Hero | Arijit Singh | Varun Dhawan,Found
PARTY,Hookah Bar,Khiladi 786,https://www.youtube.com/watch?v=b4b1cMVZOUU,Full Video: Hookah Bar | Khiladi 786 | Akshay Kumar &amp; Asin | Himesh Reshammiya,Found
PARTY,Tumhi Ho Bandhu,Cocktail,https://www.youtube.com/watch?v=o1RducJbUdc,"Tumhi Ho Bandhu - Full Video Song | Cocktail | Saif Ai Khan, Deepika Padukone &amp; Diana Penty | Pritam",Found
PARTY,Let's Nacho,Kapoor & Sons,https://www.youtube.com/watch?v=TLnwqAarPkM,Let’s Nacho - Kapoor &amp; Sons | Sidharth | Alia | Fawad | Badshah | Benny Dayal | Nucleya,Found
PARTY,High Heels,Ki & Ka,https://www.youtube.com/watch?v=N_KpjLhJa1k,HIGH HEELS TE NACHCHE Video Song | KI &amp; KA | Meet Bros ft. Jaz Dhami | Yo Yo Honey Singh | T-Series,Found
PARTY,Cutiepie,Ae Dil Hai Mushkil,https://www.youtube.com/watch?v=mVxMqmeeLXc,"Cutiepie (Full Video) | ADHM | Ranbir Kapoor Anushka | Pardeep, Nakash Aziz | Pritam | Karan Johar",Found
PARTY,Suraj Dooba Hai,Roy,https://www.youtube.com/watch?v=nJZcbidTutE,&#39;Sooraj Dooba Hain&#39; FULL VIDEO SONG | Arijit singh Aditi Singh Sharma | T-SERIES,Found
